title,user,time,text,url,location,platform
What is the best method for users to securely submit malware samples?,tsuto,2022-06-24T14:38:14,What is the best method for users to securely submit malware samples?,https://www.reddit.com/r/cybersecurity/comments/vjpy7x/what_is_the_best_method_for_users_to_securely/,No Data,reddit
Top cybersecurity stories for the week of 06-20-22 to 06-24-22,CISO_Series_Producer,2022-06-24T14:10:41,Top cybersecurity stories for the week of 06-20-22 to 06-24-22,https://www.reddit.com/r/cybersecurity/comments/vjpcw3/top_cybersecurity_stories_for_the_week_of_062022/,No Data,reddit
IOC Walkthrough examples,not_a_lob,2022-06-24T09:18:41,IOC Walkthrough examples,https://www.reddit.com/r/cybersecurity/comments/vjk9kh/ioc_walkthrough_examples/,No Data,reddit
Depth vs Breadth,Flaky_Card2907,2022-06-23T19:27:46,Depth vs Breadth,https://www.reddit.com/r/cybersecurity/comments/vj4y7r/depth_vs_breadth/,No Data,reddit
"Russian govt hackers hit Ukraine with Cobalt Strike, CredoMap malware. The sent emails supposedly come from the State Tax Service of Ukraine, with the subject: ""Notice of non-payment of tax.""",Late_Ice_9288,2022-06-22T03:56:25,"Russian govt hackers hit Ukraine with Cobalt Strike, CredoMap malware. The sent emails supposedly come from the State Tax Service of Ukraine, with the subject: ""Notice of non-payment of tax.""",https://www.bleepingcomputer.com/news/security/russian-govt-hackers-hit-ukraine-with-cobalt-strike-credomap-malware/,No Data,reddit
Is Macro Malware Dead?,komodoconsulting,2022-06-21T18:48:58,Is Macro Malware Dead?,https://www.komodosec.com/post/is-macro-malware-dead?utm_source=Reddit&amp;utm_medium=Redditsharing+&amp;utm_campaign=June,No Data,reddit
